it_id	italian	nl_id	dutch
3943937	Le vecchie regole non valgono.	7694808	De oude regels zijn niet van toepassing.
435554	Il nostro ristorante è il migliore.	814135	Ons restaurant is het beste.
2985964	L'amore e la tosse non possono essere nascosti.	755028	Liefde en hoest kan men niet verbergen.
4586871	In guardia!	7680604	En garde!
7805722	Lei è vegetariana.	8759636	Ze is vegetariër.
5095731	Dio, dammi la pazienza!	3643313	God, geef me geduld!
1598849	Sono le dieci e venti.	8443160	Het is twintig over tien.
1078279	Cosa ne pensa, dottore?	741238	Wat denkt ge, dokter?
1689845	Sono allergica al glutine.	7644009	Ik ben allergisch voor gluten.
723351	Sto cercando un assistente.	6606674	Ik zoek een assistent.
631593	Abbiamo insistito sulla sua importanza.	12572833	We stonden op zijn belangrijkheid.
4316376	Le mie orecchie sono rosse?	7770027	Zijn mijn oren rood?
5061881	È chiaramente inevitabile.	8556713	Dat is duidelijk niet te vermijden.
4565708	Chi è morto?	6025002	Wie is overleden?
3837399	Tom è positivo.	9463664	Tom is positief.
1445748	Spesso mi sento depresso.	6059995	Ik voel me vaak lusteloos.
4347909	Tom lavora troppo.	7814574	Tom werkt te veel.
2704270	Sono stanco come te.	2704272	Ik ben net zo moe als jij.
2394566	Puoi continuare?	2969110	Kun je voortzetten?
2453140	Maria conosce a memoria i testi classici cinesi.	8191513	Maria kent de klassieke Chinese teksten uit het hoofd.
7846269	Tom è molto più vecchio di sua moglie.	7847592	Tom is veel ouder dan zijn vrouw.
2676018	Perché non prendeva l'autobus?	2676021	Waarom heb je de bus niet genomen?
1428986	Siamo impazienti!	8837384	We zijn ongeduldig.
4504889	Ci eravamo conosciute quattro anni fa.	4504908	Wij hadden vier jaar geleden elkaar ontmoet.
602471	Apri il tuo cuore.	1017048	Open je hart.
3247715	Il dentista ha detto che ho la pulpite.	9033959	De tandarts zei dat ik pulpitis had.
4730028	Il mango è il frutto nazionale di vari paesi.	8443724	De mango is de nationale vrucht van meerdere landen.
7430173	I vegani non mangiano alcun prodotto animale.	7611416	Veganisten eten geen dierlijke producten.
380191	Confronta le tue risposte con quelle del professore.	3127600	Vergelijk jouw antwoorden met die van de professor.
6104636	Ho pagato.	7981003	Ik heb betaald.
1871452	Le finestre sono aperte.	7898284	De ramen zijn open.
2256307	È incredibile!	2352889	Het is ongelooflijk!
4740868	Il bingo è qualcosa a cui giocano le nonne.	4299253	Bingo is iets voor oma's.
9211384	Tom stava indossando un costume.	9211653	Tom droeg een kostuum.
1244681	Yerevan è la capitale dell'Armenia.	7463140	Jerevan is de hoofdstad van Armenië.
4670478	Tom ha dei figli?	4670830	Heeft Tom kinderen?
763134	Non è morto invano.	383993	Hij is niet voor niets omgekomen.
8991981	Vogliamo vedere i risultati.	9082912	We willen de uitslagen zien.
3883831	"La Norvegia si chiama ""Norge"" in norvegese."	7462479	"Noorwegen wordt ""Norge"" genoemd in het Noors."
3163809	Tom ha tre alberi di mele nel suo giardino.	9685507	Tom heeft drie appelbomen in zijn tuin.
846139	Sto cercando un impiego.	846019	Ik zoek een baan.
1767255	Grazie per la sua attenzione.	10051706	Bedankt voor uw aandacht.
4538446	La mucca muggisce.	7487926	De koe loeit.
379773	Ero abituato al caldo.	1559540	Ik was gewend aan de hitte.
4481564	Stavo aspettando che succedesse qualcosa.	4481566	Ik was aan het wachten tot er iets zou gebeuren.
8785258	Ciao, Hanako.	4328691	Hallo, Hanako.
2731736	Lei viene dal nord.	2731739	Zij komt uit het noorden.
3148899	Il suo libro è rosso.	7770024	Haar boek is rood.
2608435	Tom comprò un regalo per Mary.	3988710	Tom kocht een cadeautje voor Mary.
387186	In ogni caso, è sempre colpa mia.	4478073	In alle geval ben ik altijd schuldig.
2704002	Mi chiamo Francesco.	8934316	Ik heet Francesco.
5390754	I prezzi variano in base alla posizione.	5383389	De prijzen variëren al naargelang de plaats.
5282077	Perché incolpare Tom?	9259162	Waarom Tom de schuld geven?
5668422	Non ti sei fatta male?	6982148	Heb je je geen pijn gedaan?
701135	Quello che ha detto non è vero.	701139	Wat hij zei, is niet waar.
3067437	Cosa intendi esattamente?	3068519	Wat bedoel je precies?
5384870	Tom ha scritto due libri.	7807066	Tom heeft twee boeken geschreven.
3256496	Non c'è carta igienica.	388406	Er is geen toiletpapier.
5906319	Mi presi cura del suo gatto.	11048044	Ik zorgde voor haar kat.
5967822	Il mio italiano è terribile.	7906617	Mijn Italiaans is vreselijk.
3117963	Il trattato di Amsterdam è un fallimento totale.	3126796	Het Verdrag van Amsterdam is een totale mislukking.
2697972	Dov'è il ristorante?	7694850	Waar is het restaurant?
11562723	La somma di due più dieci fa dodici.	11562728	De som van twee en tien is twaalf.
3000439	Le Isole Vergini britanniche sono un paradiso fiscale.	8981431	De Britse Maagdeneilanden zijn een belastingparadijs.
4471541	Lei starebbe meglio senza te.	4471544	Zij zou beter zonder jou wezen.
7372615	Dirò a Tom che sei pronta.	4869289	Ik zal Tom zeggen dat je klaar bent.
